{
  "schema_version": 2,
  "id": "H-M0-075",
  "version": 4,
  "created_at": "2026-10-15T16:50:11Z",
  "sender": "00 Director",
  "recipient": "00 Director",
  "status": "COMPLETED",
  "request": "Apply the explicitly authorized metadata-only correction to the preserved H-M0-075 review prerequisite by binding it to the exact H-M0-074.v1 revision reviewed at source commit 670b1df2e7b8f59a739dc4c15bf21c6c2868b966.",
  "work_done": "Metadata-only successor authored by native writer /root acting as 00 Director under the user's explicit governance/schema-change authority. The independent H-M0-075.v3 review verdict remains M0_2_M0_3_ADAPTER_PLAN_REQUIRES_REVISION without alteration: published captures replay exactly and retained frozen source is genuine, but the reference verifier accepts a coordinated replacement of frozen source, inventory and output; dependency captures omit repository/package bindings; currentness has no closed executable contract; and authentic captures are not mapped into the V12 persistence graph. This successor changes only the dependency representation so the review prerequisite resolves immutably to the H-M0-074.v1 bytes the Skeptic consumed. It is not a new Skeptic review or approval and claims no change to the original verdict, evidence, findings, STOPs, Data status, capital status, or operational authority.",
  "evidence_refs": [
    "docs/handoffs/H-M0-075.v1.json",
    "docs/handoffs/H-M0-075.v2.json",
    "reports/reviews/M0.2-M0.3-authentic-evidence-final-plan-review.v1.md",
    "reports/skeptic-authentic-stage1-final-plan/results.v1.json",
    "reports/skeptic-authentic-stage1-final-plan/preservation.v1.json",
    "reports/skeptic-authentic-stage1-final-plan/validation.v1.txt",
    "tests/test_skeptic_authentic_stage1_plan_v13.py",
    "reports/audit/A-M0-061.v1.json",
    "docs/handoffs/H-M0-074.v1.json",
    "docs/handoffs/H-M0-082.v1.json"
  ],
  "files_changed": [
    "docs/handoffs/H-M0-075.v4.json"
  ],
  "tests_run": [
    "Metadata verification: working-tree SHA-256 and source-commit 670b1df2e7b8f59a739dc4c15bf21c6c2868b966 SHA-256 for docs/handoffs/H-M0-074.v1.json both equal 01812864de27568ada00d66b20d0dfb6dd763b607924a0b77ef70eacf7dec782.",
    "No independent review was rerun for this metadata correction; H-M0-075.v3 remains the preserved Skeptic verdict and evidence source."
  ],
  "open_questions": [
    "Director must choose and publish the trusted immutable root and canonical authentic-capture persistence mapping.",
    "Director must publish a closed currentness binding/source-resolution/comparison contract.",
    "The historical H-M0-074 CLAIMED/completion inconsistency observed by the original review is preserved; this successor only identifies the exact v1 revision reviewed."
  ],
  "blockers": [
    "Data remains BLOCKED; this correction does not release implementation.",
    "STOP-M0-001 and STOP-M0-3A-001 remain OPEN; M0 blocked; M1 unreleased; capital LOCKED."
  ],
  "next_action": "Preserve the original Director remediation and focused Skeptic-review routing; this metadata correction creates no new approval or release.",
  "completion_criteria": [
    "A self-consistent replacement of retained historical source/evidence/output fails against an externally pinned authoritative root.",
    "All authentic captures use one closed persisted format with verified runtime/Git/package closure.",
    "Every currentness dimension is schema-bound, deterministically resolved and empirically denied on drift."
  ],
  "depends_on": [
    {
      "path": "docs/handoffs/H-M0-074.v1.json",
      "kind": "handoff",
      "id": "H-M0-074",
      "version": 1,
      "sha256": "01812864de27568ada00d66b20d0dfb6dd763b607924a0b77ef70eacf7dec782"
    }
  ]
}
