{
  "schema_version": 2,
  "id": "H-M0-134",
  "version": 1,
  "created_at": "2026-10-30T02:16:26Z",
  "sender": "00 Director",
  "recipient": "00 Director",
  "status": "COMPLETED",
  "request": "Classify the next smallest semantically complete direct resource maximum while retaining incomplete coverage and generation denial.",
  "work_done": "Added the cumulative V11 _PORTABLE_COMPONENT_MAX semantic classification over its sole definition and generator comparison; retained all V10 constraints exactly; bound the slash split, preceding total-path arm, and exact any(generator) short-circuit behavior; added complete component-character boundaries, ordering, later-rule independence, non-authority, and attacker-refreshed adversarial evidence; rebound the schema, evidence, ancestry, and self-digest; and preserved INCOMPLETE/DENY with 669 of 697 sites unclassified.",
  "evidence_refs": ["reports/H-M0-134-runtime-v2-portable-component-resource-classification.v1.md", "reports/audit/A-M0-116.v1.json", "reports/stops/STOP-M0-3A-002.v37.json", "docs/M0.3A_PORTABLE_COMPONENT_CHARACTER_LIMIT.v1.md", "docs/M0.3A_RUNTIME_V2_RESOURCE_CLASSIFICATION.v11.json", "schemas/m0-3a-runtime-v2-resource-classification.v11.schema.json", "docs/M0.3A_RUNTIME_V2_RESOURCE_DISCOVERY.v2.md", "docs/M0.3A_RELEASE_GENERATION_READINESS.v1.md", "tools/check_runtime_v2_release_readiness.py", "tests/test_runtime_v2_portable_component_bound.py", "tests/test_runtime_v2_release_readiness.py"],
  "files_changed": ["docs/M0.3A_PORTABLE_COMPONENT_CHARACTER_LIMIT.v1.md", "docs/M0.3A_RUNTIME_V2_RESOURCE_CLASSIFICATION.v11.json", "schemas/m0-3a-runtime-v2-resource-classification.v11.schema.json", "docs/M0.3A_RUNTIME_V2_RESOURCE_DISCOVERY.v1.md", "docs/M0.3A_RUNTIME_V2_RESOURCE_DISCOVERY.v2.md", "docs/M0.3A_RELEASE_GENERATION_READINESS.v1.md", "tools/check_runtime_v2_release_readiness.py", "tools/run_test_tier.py", "tests/test_runtime_v2_portable_component_bound.py", "tests/test_runtime_v2_release_readiness.py", "reports/H-M0-134-runtime-v2-portable-component-resource-classification.v1.md", "reports/audit/A-M0-116.v1.json", "reports/stops/STOP-M0-3A-002.v37.json", "docs/handoffs/H-M0-134.v1.json", "docs/project-state.json", "examples/alpha/sample-workflow.v1.json", "tests/test_alpha.py", "tests/test_web.py"],
  "tests_run": ["43 focused readiness and portable-component tests passed normally and under optimized Python.", "438 fast-tier tests passed across 30 isolated modules.", "Three independent bounded final reviews reproduced the exact two-site component slice and returned ACCEPT.", "464 governed records and published history validated; M0 capital remained LOCKED.", "18 alpha and observatory tests passed after evidence publication."],
  "open_questions": ["Should the next source-level slice classify MAX_GROUP_EVENTS only after explicit relational reconciliation with same-valued group and event-envelope constraints?", "Which remaining aggregate/cardinality families require Discovery v3 branch-specific or accumulator-dependency bindings before honest classification?"],
  "blockers": ["STOP-M0-3A-002.v37 remains OPEN.", "Only twenty-eight of 697 census sites are semantically classified; 669 remain unclassified with INCOMPLETE coverage.", "Public verification remains deny-only.", "Live remains LOCKED and deployable capital remains USD 0."],
  "next_action": "Select and classify the next smallest semantically complete resource maximum under exact binding, relational-dependency, evidence, and adversarial-review discipline; add discovery bindings first when a candidate cannot be represented honestly; retain incomplete coverage and generation denial.",
  "completion_criteria": ["Exactly one additional bounded resource maximum and every definition/enforcement/relational dependency needed for its meaning are fixed and adversarially tested.", "All other sites remain unclassified and RESOURCE_INVENTORY_INCOMPLETE remains unconditional.", "No closure/carrier, positive verifier result, STOP clearance, or operational/capital authority is created."],
  "depends_on": [{"path": "docs/handoffs/H-M0-133.v1.json", "kind": "handoff", "id": "H-M0-133", "version": 1, "sha256": "ae7301bc9089a488419e8d38cf64d3b69c86050ef1b69fda0156f7b997b07820"}]
}
