{
  "schema_version": 2,
  "id": "H-M0-139",
  "version": 1,
  "created_at": "2026-10-30T04:33:20Z",
  "sender": "00 Director",
  "recipient": "00 Director",
  "status": "COMPLETED",
  "request": "Classify the smallest semantically complete Discovery V3 cardinality family without changing runtime behavior, authority, STOP status, or capital controls.",
  "work_done": "Added Classification V16 as an exact V15-prefix successor and classified MAX_CHECKPOINT_COPIES over its sole definition and exact checkpoint_copies branch binding; added a governing contract, exact boundary and combined cardinality/member-size tests, attacker-refreshed semantic-pin attacks, and fast-tier registration; retained INCOMPLETE/DENY with forty of 703 sites classified and 663 unclassified.",
  "evidence_refs": [
    "reports/H-M0-139-runtime-v2-checkpoint-copy-cardinality-classification.v1.md",
    "reports/audit/A-M0-121.v1.json",
    "reports/stops/STOP-M0-3A-002.v42.json",
    "docs/M0.3A_RUNTIME_CHECKPOINT_COPY_CARDINALITY_LIMIT.v1.md",
    "docs/M0.3A_RUNTIME_V2_RESOURCE_DISCOVERY.v3.md",
    "docs/M0.3A_RUNTIME_V2_RESOURCE_DISCOVERY.v3.json",
    "docs/M0.3A_RUNTIME_V2_RESOURCE_CLASSIFICATION.v16.json",
    "schemas/m0-3a-runtime-v2-resource-classification.v16.schema.json",
    "docs/M0.3A_RELEASE_GENERATION_READINESS.v1.md",
    "tools/check_runtime_v2_release_readiness.py",
    "tests/test_runtime_v2_checkpoint_copy_cardinality_bound.py",
    "tests/test_runtime_v2_release_readiness.py"
  ],
  "files_changed": [
    "docs/M0.3A_RELEASE_GENERATION_READINESS.v1.md",
    "docs/M0.3A_RUNTIME_CHECKPOINT_COPY_CARDINALITY_LIMIT.v1.md",
    "docs/M0.3A_RUNTIME_V2_RESOURCE_CLASSIFICATION.v16.json",
    "docs/M0.3A_RUNTIME_V2_RESOURCE_DISCOVERY.v3.md",
    "schemas/m0-3a-runtime-v2-resource-classification.v16.schema.json",
    "tests/test_runtime_v2_checkpoint_copy_cardinality_bound.py",
    "tests/test_runtime_v2_release_readiness.py",
    "tools/check_runtime_v2_release_readiness.py",
    "tools/run_test_tier.py",
    "reports/H-M0-139-runtime-v2-checkpoint-copy-cardinality-classification.v1.md",
    "reports/audit/A-M0-121.v1.json",
    "reports/stops/STOP-M0-3A-002.v42.json",
    "docs/handoffs/H-M0-139.v1.json",
    "docs/project-state.json",
    "examples/alpha/sample-workflow.v1.json",
    "tests/test_alpha.py",
    "tests/test_web.py"
  ],
  "tests_run": [
    "41 readiness tests passed, including V16 prefix, attacker-refreshed census, and manifest mutation attacks.",
    "10 dedicated checkpoint-copy boundary tests passed normally and under optimized Python.",
    "478 fast-tier tests passed across 34 isolated modules.",
    "Normal and optimized readiness outputs were byte-identical and both remained exit 1 BLOCKED/DENY.",
    "Independent bounded inventory and Skeptic reviews reproduced the final evidence; Skeptic rejected the first evidence matrix and accepted the repaired combined-boundary cases.",
    "476 governed records and published history validated before governance publication; 479 validated after publication.",
    "18 alpha and observatory tests passed after evidence publication."
  ],
  "open_questions": [
    "Which remaining Discovery V3 cardinality family is the smallest next semantically complete slice?",
    "Can MAX_BLOBS be classified without conflating tuple cardinality, per-blob byte size, total accounting, or downstream reachability limits?"
  ],
  "blockers": [
    "STOP-M0-3A-002.v42 remains OPEN.",
    "Only forty of 703 census sites are semantically classified; 663 remain unclassified with INCOMPLETE coverage.",
    "Public verification remains deny-only.",
    "Live remains LOCKED and deployable capital remains USD 0."
  ],
  "next_action": "Inventory and independently review the smallest remaining semantically complete Discovery V3 cardinality family, provisionally MAX_BLOBS, without assuming that a same-valued limit has the same subject or enforcement semantics.",
  "completion_criteria": [
    "The selected cardinality constraint is bound to every definition and exact V3 branch site with inclusive boundary, guard-order, accounting, and hostile-type evidence.",
    "Sibling minima, maxima, exact cardinalities, byte ceilings, total-accounting limits, and dynamic relations remain separately classified or unclassified as evidence requires.",
    "RESOURCE_INVENTORY_INCOMPLETE remains unconditional and no closure, carrier, verifier acceptance, STOP clearance, or capital authority is created."
  ],
  "depends_on": [
    {
      "path": "docs/handoffs/H-M0-138.v1.json",
      "kind": "handoff",
      "id": "H-M0-138",
      "version": 1,
      "sha256": "653a655d5e05046e79d75da3d1f4a6c284aa7b4c7a08c911fef0bd18df461ede"
    }
  ]
}
