{
  "schema_version": 2,
  "id": "H-M0-127",
  "version": 1,
  "created_at": "2026-10-29T21:48:04Z",
  "sender": "00 Director",
  "recipient": "00 Director",
  "status": "COMPLETED",
  "request": "Classify the next smallest unambiguous non-relational resource maximum under exact semantic-dependency, evidence, and adversarial-review bindings while retaining incomplete coverage and generation denial.",
  "work_done": "Added cumulative resource-classification v4, byte-bound the complete v3 predecessor, re-audited the v2/v1 ancestor chain, and classified only MAX_SCHEMA_REF_NODES plus its exact definition/enforcement sites. Bound all source/schema census identities, the complete verifier source-module and schema-safety-function ASTs, an additive exact contract, dedicated boundary evidence, and adversarial fail-closed behavior. Coverage remains INCOMPLETE with 680 sites unclassified and generation denied.",
  "evidence_refs": ["reports/H-M0-127-runtime-v2-schema-reference-node-resource-classification.v1.md", "reports/audit/A-M0-109.v1.json", "reports/stops/STOP-M0-3A-002.v30.json", "docs/M0.3A_RUNTIME_V2_RESOURCE_CLASSIFICATION.v4.json", "schemas/m0-3a-runtime-v2-resource-classification.v4.schema.json", "docs/M0.3A_SCHEMA_REFERENCE_GRAPH_LIMIT.v1.md", "docs/M0.3A_RUNTIME_V2_RESOURCE_DISCOVERY.v1.md", "docs/M0.3A_RELEASE_GENERATION_READINESS.v1.md", "tools/check_runtime_v2_release_readiness.py", "tests/test_runtime_v2_release_readiness.py", "tests/test_runtime_v2_schema_ref_node_bound.py"],
  "files_changed": ["docs/M0.3A_RUNTIME_V2_RESOURCE_CLASSIFICATION.v4.json", "schemas/m0-3a-runtime-v2-resource-classification.v4.schema.json", "docs/M0.3A_SCHEMA_REFERENCE_GRAPH_LIMIT.v1.md", "docs/M0.3A_RUNTIME_V2_RESOURCE_DISCOVERY.v1.md", "docs/M0.3A_RELEASE_GENERATION_READINESS.v1.md", "tools/check_runtime_v2_release_readiness.py", "tests/test_runtime_v2_release_readiness.py", "tests/test_runtime_v2_schema_ref_node_bound.py", "tools/run_test_tier.py", "reports/H-M0-127-runtime-v2-schema-reference-node-resource-classification.v1.md", "reports/audit/A-M0-109.v1.json", "reports/stops/STOP-M0-3A-002.v30.json", "docs/handoffs/H-M0-127.v1.json", "docs/project-state.json", "examples/alpha/sample-workflow.v1.json", "tests/test_alpha.py", "tests/test_web.py"],
  "tests_run": ["76 focused readiness, closure, image, verifier, schema-document, and schema-reference-node tests passed normally and under optimized Python.", "382 fast-tier tests passed across 24 isolated modules.", "Final implementation, Skeptic, and independent diff rereviews accepted after stale narrative and test-expectation blockers were repaired.", "440 governed records and published history validated before evidence publication; 443 expected after publication.", "18 alpha and observatory tests must pass after evidence publication."],
  "open_questions": ["Which next exact non-relational maximum has a complete, independently reviewable source-level semantic dependency boundary?", "How should shared generic enforcement sites be modeled or split before their individual bound constants can be classified honestly?"],
  "blockers": ["STOP-M0-3A-002.v30 remains OPEN.", "Only ten of 690 census sites are semantically classified; 680 remain unclassified with INCOMPLETE coverage.", "Public verification remains deny-only.", "Live remains LOCKED and deployable capital remains USD 0."],
  "next_action": "Classify the next smallest unambiguous non-relational resource maximum under the same exact predecessor, schema, semantic-dependency, evidence, and adversarial-review discipline; retain incomplete coverage and generation denial.",
  "completion_criteria": ["Exactly one additional bounded resource maximum and every source-level definition/enforcement dependency needed for its meaning are fixed and adversarially tested.", "All other sites remain unclassified and RESOURCE_INVENTORY_INCOMPLETE remains unconditional.", "No closure/carrier, positive verifier result, STOP clearance, or operational/capital authority is created."],
  "depends_on": [{"path": "docs/handoffs/H-M0-126.v1.json", "kind": "handoff", "id": "H-M0-126", "version": 1, "sha256": "90b179c0d0ba03bf88c873c193b6c52182c11bfdda0e3b7a91b478e1e209e319"}]
}
