{
  "schema_version": 2,
  "id": "H-M0-122",
  "version": 1,
  "created_at": "2026-10-29T19:39:44Z",
  "sender": "00 Director",
  "recipient": "00 Director",
  "status": "COMPLETED",
  "request": "Freeze the runtime-v2 verifier source inventory and generate the exact dependency-closure carrier only if contract prerequisites are satisfied.",
  "work_done": "Determined that exact generation is contract-invalid while the public entrypoint, V1 bridge, resource completeness, and A-J evidence remain unresolved. Implemented a deterministic fixed-root read-only readiness checker that inventories prospective inputs, rejects hostile aliases and indirection, and unconditionally returns BLOCKED/DENY without generating a closure or carrier.",
  "evidence_refs": ["reports/H-M0-122-runtime-v2-release-readiness.v1.md", "reports/audit/A-M0-104.v1.json", "reports/stops/STOP-M0-3A-002.v25.json", "docs/M0.3A_RELEASE_GENERATION_READINESS.v1.md", "tools/check_runtime_v2_release_readiness.py", "tests/test_runtime_v2_release_readiness.py"],
  "files_changed": ["docs/M0.3A_RELEASE_GENERATION_READINESS.v1.md", "tools/check_runtime_v2_release_readiness.py", "tests/test_runtime_v2_release_readiness.py", "tools/run_test_tier.py", "reports/H-M0-122-runtime-v2-release-readiness.v1.md", "reports/audit/A-M0-104.v1.json", "reports/stops/STOP-M0-3A-002.v25.json", "docs/handoffs/H-M0-122.v1.json", "docs/project-state.json", "examples/alpha/sample-workflow.v1.json"],
  "tests_run": ["11 focused readiness tests passed normally and under optimized Python.", "363 fast-tier tests passed across 22 isolated modules.", "Independent Skeptic and diff reviews found no blocker after seven fail-closed and accuracy defects were repaired.", "425 governed records and published history validated before evidence publication; 428 validated after publication.", "18 alpha and observatory tests passed after evidence publication."],
  "open_questions": ["What exact reviewed manifest proves that every semantic runtime-v2 resource limit is inventoried?", "Does the retained legacy amendment formally supersede acceptance case D, or is a new versioned bridge experiment required?"],
  "blockers": ["STOP-M0-3A-002.v25 remains OPEN.", "The readiness checker reports four explicit blockers and can never permit generation.", "Public verification remains deny-only.", "Live remains LOCKED and deployable capital remains USD 0."],
  "next_action": "Compile and independently review the exact runtime-v2 semantic resource-limit manifest and its adversarial completeness tests; keep closure/carrier generation denied.",
  "completion_criteria": ["The readiness checker deterministically inventories the prospective fixed-root source, schema, content, domain, limit, and runtime inputs without emitting release artifacts.", "External/dynamic imports, aliases, unsafe paths, unstable reads, incomplete markers, decoy limits, and extra runtime files fail closed.", "All unresolved semantic and acceptance gaps remain explicit blockers and no positive result or authority is representable."],
  "depends_on": [{"path": "docs/handoffs/H-M0-121.v1.json", "kind": "handoff", "id": "H-M0-121", "version": 1, "sha256": "08a8ed18b93e8a2e2d3f6cb0666312c63e52e756e51359702bb19b5c2b9b0db7"}]
}
