{
  "schema_version": 2,
  "id": "H-M0-128",
  "version": 1,
  "created_at": "2026-10-29T22:14:04Z",
  "sender": "00 Director",
  "recipient": "00 Director",
  "status": "COMPLETED",
  "request": "Resolve the generic table-comparator discovery ambiguity before classifying another resource maximum, while retaining incomplete coverage and generation denial.",
  "work_done": "Added resource-discovery v2 with seven exact fail-closed branch-specific table-binding records while preserving all 394 v1 source records. Added a closed discovery manifest/schema, rebased classification v5 onto the 401-source-site census without adding or changing any semantic constraint, and adversarially tested table, row, subject, maximum, loop, comparator, predecessor, artifact, and ancestor drift. Coverage remains INCOMPLETE with 687 sites unclassified and generation denied.",
  "evidence_refs": ["reports/H-M0-128-runtime-v2-resource-binding-census.v1.md", "reports/audit/A-M0-110.v1.json", "reports/stops/STOP-M0-3A-002.v31.json", "docs/M0.3A_RUNTIME_V2_RESOURCE_DISCOVERY.v2.md", "docs/M0.3A_RUNTIME_V2_RESOURCE_DISCOVERY.v2.json", "schemas/m0-3a-runtime-v2-resource-discovery.v2.schema.json", "docs/M0.3A_RUNTIME_V2_RESOURCE_CLASSIFICATION.v5.json", "schemas/m0-3a-runtime-v2-resource-classification.v5.schema.json", "docs/M0.3A_RELEASE_GENERATION_READINESS.v1.md", "tools/check_runtime_v2_release_readiness.py", "tests/test_runtime_v2_release_readiness.py"],
  "files_changed": ["docs/M0.3A_RUNTIME_V2_RESOURCE_DISCOVERY.v2.md", "docs/M0.3A_RUNTIME_V2_RESOURCE_DISCOVERY.v2.json", "schemas/m0-3a-runtime-v2-resource-discovery.v2.schema.json", "docs/M0.3A_RUNTIME_V2_RESOURCE_CLASSIFICATION.v5.json", "schemas/m0-3a-runtime-v2-resource-classification.v5.schema.json", "docs/M0.3A_RUNTIME_V2_RESOURCE_DISCOVERY.v1.md", "docs/M0.3A_RELEASE_GENERATION_READINESS.v1.md", "tools/check_runtime_v2_release_readiness.py", "tests/test_runtime_v2_release_readiness.py", "reports/H-M0-128-runtime-v2-resource-binding-census.v1.md", "reports/audit/A-M0-110.v1.json", "reports/stops/STOP-M0-3A-002.v31.json", "docs/handoffs/H-M0-128.v1.json", "docs/project-state.json", "examples/alpha/sample-workflow.v1.json", "tests/test_alpha.py", "tests/test_web.py"],
  "tests_run": ["79 focused readiness, closure, image, verifier, schema-document, and schema-reference-node tests passed normally and under optimized Python.", "385 fast-tier tests passed across 24 isolated modules.", "Final implementation-diff and independent Skeptic reviews accepted the fail-closed census rebase.", "443 governed records and published history validated before evidence publication; 446 expected after publication.", "18 alpha and observatory tests must pass after evidence publication."],
  "open_questions": ["Which newly explicit branch-specific maximum is the next smallest semantically complete non-relational classification slice?", "Which remaining generic or relational mechanisms require additional execution-binding records before honest classification?"],
  "blockers": ["STOP-M0-3A-002.v31 remains OPEN.", "Only ten of 697 census sites are semantically classified; 687 remain unclassified with INCOMPLETE coverage.", "Public verification remains deny-only.", "Live remains LOCKED and deployable capital remains USD 0."],
  "next_action": "Select and classify the next smallest unambiguous branch-specific non-relational resource maximum under exact binding, semantic-dependency, evidence, and adversarial-review discipline; retain incomplete coverage and generation denial.",
  "completion_criteria": ["Exactly one additional bounded resource maximum and every branch-specific definition/enforcement dependency needed for its meaning are fixed and adversarially tested.", "All other sites remain unclassified and RESOURCE_INVENTORY_INCOMPLETE remains unconditional.", "No closure/carrier, positive verifier result, STOP clearance, or operational/capital authority is created."],
  "depends_on": [{"path": "docs/handoffs/H-M0-127.v1.json", "kind": "handoff", "id": "H-M0-127", "version": 1, "sha256": "3a26e05eecfdff00a1f904dc2834058c062760356d94e760f18b6cc794bf7eef"}]
}
